{
  "format": "pixelforge-autotile",
  "version": 1,
  "name": "water",
  "tile": 8,
  "mode": "blob",
  "palette": { "$ref": "palette.json" },
  "template": [
    "cccccccckcccccck",
    "ccccc1ccccccc1cc",
    "cccccccccccccccc",
    "cccccccccccccccc",
    "cc2ccccccc2ccccc",
    "cccccccccccccccc",
    "cccccc1ccccccc1c",
    "cccccccckcccccck",
    ".kkkkkkkkkkkkkk.",
    "kttttttttttttttk",
    "kssssssssssssssk",
    "kdbbbbbbbbbbbbdk",
    "kd2ccccccc2cccdk",
    "kdccccccccccccdk",
    "kdcccc1cccccccdk",
    "kdccccccccccccdk",
    "kdccccccccccccdk",
    "kdccc1ccccccc1dk",
    "kdccccccccccccdk",
    "kdccccccccccccdk",
    "kd2ccccccc2cccdk",
    "kdccccccccccccdk",
    "kddddddddddddddk",
    ".kkkkkkkkkkkkkk."
  ],
  "frame": "water-{mask}-{variant}",
  "animation": "water-{mask}",
  "variants": [
    { "name": "v0", "duration": 180, "palette": { "1": "c", "2": "d" } },
    { "name": "v1", "duration": 180, "palette": { "1": "d", "2": "e" } },
    { "name": "v2", "duration": 180, "palette": { "1": "e", "2": "c" } },
    { "name": "v3", "duration": 180, "palette": { "1": "c", "2": "c" } }
  ]
}
