{
  "format": "pixelforge-autotile",
  "version": 1,
  "name": "grass",
  "tile": 16,
  "mode": "blob",
  "palette": {
    "$ref": "../palette.json"
  },
  "template": [
    "..................jjhhhhhhhhgl..",
    ".................ljjhhhhhhjhhg..",
    ".........ll......jjhhhhhhhhjhhg.",
    ".....ljjjgj.....jjhjhhhhhhhhhhhj",
    "...jjjjhhhjg....hhhhhhhhhhhhhhgh",
    "...jjhhjhhhhg...hhhhhhhjhhhhhhhh",
    "...jhhjhjhhhg...hhhhhhjhjhhhhhhh",
    "...jhhhhhhhhg...hghhhhhhhhhhhhhh",
    "...jhhhhhhhhg...hhhhhhhhhhhhhhhh",
    "...jhhhhhhhhg...hhhhhhhhhhhhjhhh",
    "...gjhhhhhhgg...hhhhjhhhhhhjhhhh",
    "..._gghhhhhg_...hhhhhjhhhhhhhhhh",
    "....__gggggg....ghhhhhhhhgghhhgg",
    "......______...._ghhhhhhhhhhhgg_",
    "................._ghhhhhhhhhgg_.",
    ".................._jhhhhhhhhg_..",
    "................................",
    "..................l.............",
    ".........l...l....j..l...ll.....",
    ".....ljjjjggjjjg.ljjjjjjjgj.....",
    "...jjjjhhgj_jhghjjjhhhhhhhjg....",
    "...jjhhjhhjjjhhhhhhhhhhjhhhhg...",
    "...jhhjhjhhhhhhhhhhhhhjhjhhhg...",
    "...jhhhhhhhhhhhhhghhhhhhhhhhg...",
    "...ghhhhhhhhhhhhhhhhhhhhhhhhg...",
    "..._jhhhhhhhjhhhhhhhhhhhhhhhg...",
    "....jhhhhhhjhhhhhhhhjhhhhhhjg...",
    "..jjjjhhhhhhhhhhhhhhhjhhhhhgg...",
    "...jhhhhhgghhhhhhhhhhhhhhggg_...",
    "...jhhhhhhhhhhhhhhhhhhhhhhhg....",
    "...jhhhhhhhhhhjhhjhhhhhhhhhhg...",
    "...jhhhhhhhhhhhjhhjhhhhhhhhhg...",
    "...jhhhhhhhhhhhhhhhhhhhhhhhhg...",
    "...jhhhhhhjhhhhhhhhhhhhhhhjhg...",
    "...jhhhhhhhjhhhhhhjhhhhhhhhgg...",
    "...ghhhhhhhhhhhhhhhjhhhhhhhg_...",
    "..._jhhhhhhhhhghhhhhhhhhhhhg....",
    "....jhhjhhhhhhhhhhhhhhhjhhhhg...",
    "...jjhjhjhhhhhhhhhhhhhjhjhhhg...",
    "...jhhhhhhhhhhhhhghhhhhhhhhhg...",
    "...jhhhhhhhhhhhhhhhhhhhhhhhhg...",
    "...jhhhhhhhhjhhhhhhhhhhhhhhhg...",
    "...gjhhhhhhjhhhhhhhhjhhhhhhgg...",
    "..._gghhhhhhhggghhhggghhhhhg_...",
    "....__gggggggg__gggg__gggggg....",
    "......________..____..______....",
    "................................",
    "................................"
  ],
  "frame": "grass-{mask}",
  "sheet": {
    "columns": 16
  }
}
